{
  "bench_name": "bench/pager/open_close_empty",
  "profile": {
    "name": "ci",
    "core_count": 4,
    "ram_gb": 8.0
  },
  "build": {
    "zig_version": "0.12.0",
    "mode": "ReleaseFast"
  },
  "git": {
    "sha": "abc1234"
  },
  "config": {
    "db": {
      "page_size": 16384,
      "checksum": "crc32c",
      "sync_mode": "fsync_per_commit"
    }
  },
  "results": {
    "ops_total": 10000,
    "duration_ns": 500000000,
    "ops_per_sec": 20000.0,
    "latency_ns": {
      "p50": 50,
      "p95": 100,
      "p99": 200,
      "max": 500
    },
    "bytes": {
      "read_total": 0,
      "write_total": 0
    },
    "io": {
      "fsync_count": 0
    },
    "alloc": {
      "alloc_count": 100,
      "alloc_bytes": 8192
    },
    "errors_total": 0
  },
  "repeat_index": 0,
  "repeat_count": 5,
  "timestamp_utc": "2024-01-01T00:00:00Z"
}